{
  "schema": "hebrinex.project_service.result",
  "contract_version": "1.0.0",
  "cli_api": "central1",
  "command": "migrate",
  "status": "planned",
  "reason": "MIGRATION_PLAN_READY",
  "exit_code": 0,
  "writes_performed": false,
  "project_id": "PRJ-00000000000000000000000000000000",
  "observed_at": "1970-01-01T00:00:00.0000000Z",
  "details": {},
  "next_step": "Review the immutable descriptor and obtain explicit approval."
}
